{
  "alert_id": "ALERT001",
  "incident_id": "INC001",
  "session_id": "SESSION001",
  "machine_id": "EXC001",
  "operator_id": "OP1001",
  "rule_id": "SEATBELT",
  "rule_version": "demo-1",
  "type": "seatbelt",
  "severity": "warning",
  "status": "active",
  "message": "Seatbelt unfastened during machine operation.",
  "first_seen_at": "2026-09-23T10:00:00Z",
  "last_seen_at": "2026-09-23T10:00:00Z",
  "acknowledged_at": null,
  "resolved_at": null,
  "position": {
    "x_m": 20,
    "y_m": 25
  },
  "subject_id": null,
  "evidence": [],
  "action": "warn_only"
}
